[
  {
    "id": "AEJE-IQ-001",
    "domain": "Java/JVM",
    "difficulty": "advanced",
    "topic": "JMM visibility between payment worker threads",
    "question": "Riley Okonkwo is paging payment-service on Java 21 / Spring Boot 3.5.5 because two posting worker threads share a boolean posted flag on an in-memory Harbor Bike Co create. Thread A writes posted=true after ledger insert; thread B later reads the same field and sometimes still sees false, so Avery Chen's eighty-four dollar payment can be posted twice. As if you were on the interview whiteboard, walk me through Java Memory Model visibility here: what actually makes that write visible to the other worker, and what would you change in this service before you trust the flag?",
    "followUps": [
      "Which happens-before edges would you point at if the flag is a plain boolean versus volatile versus a lock release?",
      "If Priya Nair asks whether a database unique constraint on the payment id is enough by itself, how do you answer without treating the JVM race as solved?"
    ],
    "expectedConcepts": [
      "JMM happens-before and visibility, not just atomicity",
      "Plain field writes have no inter-thread happens-before",
      "volatile / lock release-acquire / concurrent utilities as publication",
      "Idempotent posting and durable uniqueness still required for money movement"
    ],
    "engineerAnswer": "A plain boolean write is not guaranteed visible to another payment worker. I would mark the flag volatile or protect both sides with the same lock so the write happens-before the read.",
    "seniorAnswer": "Visibility is a happens-before problem, not a 'threads are fast' problem. Thread A's store to a plain posted field can sit in a register or store buffer; thread B can keep reading a stale cached false. I would not sprinkle volatile on every field. I would either publish through a lock that both workers share, through an AtomicBoolean, or — better for payment-service — stop using a heap flag as the source of truth and key the post on a unique ledger row for Avery's payment id. Spring Boot 3.5.5 does not change the JMM.",
    "staffAnswer": "I treat this as a publication failure class. I ask Riley for the exact field, whether it is safely published after construction, and whether workers are platform or virtual threads — the JMM rules are the same, but pinning and carrier reuse can hide races in dumps. I want a regression that two threads can run postAuthorized on the same payment id and only one ledger row survives. I also ask Jordan Voss not to ship a 'volatile everywhere' cleanup PR without a review bar: shared mutable state in the posting path needs an owner, a happens-before story, and a durable uniqueness story. In-memory flags are a teaching smell on a money path.",
    "principalAnswer": "I will not accept an architecture where Harbor Bike Co money movement is protected only by an unsynchronized boolean. Policy: inter-thread publication on payment-service is either a documented concurrent type or it is not shared. The modular monolith may keep posting in-process; that does not excuse a JMM hole. I fund a unique constraint and an idempotency record, not a style guide that says 'add volatile.' If someone proposes bouncing Morgan Hale's leftover cell because two workers disagreed, I reject that as the wrong estate.",
    "commonMistakes": [
      "Saying synchronized is only about mutual exclusion and ignoring visibility.",
      "Claiming Thread.sleep or a log statement 'fixes' the race because it happens to flush.",
      "Treating virtual threads as a different memory model than platform threads."
    ],
    "scoreRubric": "Engineer: names visibility and a correct publication tool. Senior: separates happens-before from atomicity and prefers a durable uniqueness story for posting. Staff: demands a reproducing test and a review bar for shared mutable state. Principal: sets policy that money movement is not guarded by unsynchronized flags and refuses leftover-cell theater."
  },
  {
    "id": "AEJE-IQ-002",
    "domain": "Java/JVM",
    "difficulty": "advanced",
    "topic": "synchronized vs ReentrantLock vs virtual threads",
    "question": "Jordan Voss wants to add a per-account lock around PaymentApplicationService.create on BayPay's Java 21 / Spring Boot 3.5.5 payment-service so two Harbor Bike Co creates for Avery Chen's USD account cannot interleave. A teammate says use synchronized, another wants ReentrantLock, and Sam Okada just enabled virtual threads on the Tomcat connector. Talk me through which lock you would pick, what each one does to virtual threads, and what you would refuse to lock.",
    "followUps": [
      "What happens if a virtual thread hits a synchronized block that then does JDBC through Hikari?",
      "When would you drop the in-JVM lock entirely and rely on the database instead?"
    ],
    "expectedConcepts": [
      "synchronized monitor vs ReentrantLock features (tryLock, interruptible, fairness)",
      "Virtual thread pinning on synchronized / native frames in Java 21",
      "Lock scope must not cover remote I/O if you can avoid it",
      "Account-level uniqueness belongs in the ledger, not only in a heap lock"
    ],
    "engineerAnswer": "synchronized is a monitor; ReentrantLock can tryLock and unlock in a finally. I would lock the smallest critical section and unlock in finally so a failed create cannot hold Avery's account.",
    "seniorAnswer": "I would not hold either lock across the authorizer or JDBC. On Java 21, synchronized can pin the virtual thread's carrier if the block does blocking I/O; a long pin starves other creates on that carrier. ReentrantLock in Java 21 is friendlier for virtual threads when you need tryLock and timed waits, but it is still a heap lock: it does not serialize two payment-service tasks. For Harbor Bike Co I prefer a unique idempotency key plus a transactional create, and I only add an in-process lock if we are still in the modular monolith and have measured a hot account race that the database has not yet closed.",
    "staffAnswer": "I ask Riley for the lock graph and the Hikari wait histogram before I bless a lock. If the proposal is Map<UUID, ReentrantLock> keyed by account id, I want eviction, leak review, and a story for refund-service in the same JVM. I will not accept a fair lock as a default — fairness can collapse throughput on a hot account. I will accept synchronized for a tiny in-memory structure that never does I/O. I will push the team to measure pinning with JFR virtual-thread pinned events after Sam's connector change, not after a SEV-1.",
    "principalAnswer": "Policy: we do not invent a distributed lock service to decorate POST /api/v1/payments. The modular monolith is valid; in-process locking is allowed only for non-IO critical sections with an owner. Cross-instance correctness is a database uniqueness and transaction story. I will not fund a rewrite to WebSphere ND-in-Docker so someone can use container-scoped monitors. If Priya Nair's SLO is at risk because virtual threads are pinned, we shrink the synchronized regions or move the work off the carrier — we do not set -Xmx equal to the Fargate limit to 'buy more threads.'",
    "commonMistakes": [
      "Locking the entire create method including HTTP client and JDBC calls.",
      "Assuming ReentrantLock is always better, or that virtual threads make locks unnecessary.",
      "Using a global JVM lock as if it coordinated two Fargate tasks."
    ],
    "scoreRubric": "Engineer: contrasts monitor vs ReentrantLock and mentions finally. Senior: discusses pinning, lock scope, and database uniqueness. Staff: reviews lock graphs, fairness, and JFR pinning. Principal: refuses distributed-lock theater and ND-in-Docker, keeps modular monolith valid."
  },
  {
    "id": "AEJE-IQ-003",
    "domain": "Java/JVM",
    "difficulty": "advanced",
    "topic": "volatile vs AtomicInteger for idempotency counters",
    "question": "A BayPay engineer added a volatile int replayCount on IdempotencyService in payment-service (Java 21, Spring Boot 3.5.5) so Riley can log how many Harbor Bike Co replays hit Avery Chen's create. Under load the count is sometimes lower than the access log. Explain when volatile is enough, when you need AtomicInteger, and whether this counter should exist in the JVM at all for an interview-quality design.",
    "followUps": [
      "Why does volatile increment (count++) fail even if each write is visible?",
      "How would you expose replay rate to Priya Nair without a heap counter?"
    ],
    "expectedConcepts": [
      "volatile guarantees visibility, not atomic read-modify-write",
      "AtomicInteger CAS / getAndIncrement for counters",
      "Lost updates under concurrent replay",
      "Metrics registry vs ad-hoc heap fields"
    ],
    "engineerAnswer": "volatile makes the latest int visible but count++ is still read, add, write. Two workers can lose an increment. I would use AtomicInteger.getAndIncrement for a JVM counter.",
    "seniorAnswer": "Replay of POST /api/v1/payments is concurrent by design. A volatile int is a visibility tool; it does not make increment atomic. I would use AtomicInteger or LongAdder if the number is only a process-local diagnostic. I would not treat that number as an audit of Avery's idempotency keys — those live in the idempotency table with a request hash. If the count disagrees with access logs, I trust the logs and the table, then I delete the homemade counter or replace it with Micrometer on the replay path.",